{
  "added": "2026-07-24",
  "archive": {
    "mirrors": [
      "http://us.aminet.net/misc/emu/AmiVms.lha",
      "http://se.aminet.net/misc/emu/AmiVms.lha"
    ],
    "sha256": "e0f91061b1930f5a8f60264a6706d61f6dd16c58cb514a22852b089d38a8a68b",
    "sizeBytes": 4155483,
    "url": "http://aminet.net/misc/emu/AmiVms.lha"
  },
  "category": "Emulation",
  "conflicts": [],
  "deps": [],
  "description": "Simulates OpenVMS commands",
  "id": "amivms",
  "name": "AmiVms",
  "provides": [],
  "requiredCapabilities": [],
  "requirements": {
    "minCPU": "68020"
  },
  "tier": "A",
  "version": "-"
}
