{
  "added": "2026-07-24",
  "archive": {
    "mirrors": [
      "http://us.aminet.net/text/edit/tinyedit_aos.lha",
      "http://se.aminet.net/text/edit/tinyedit_aos.lha"
    ],
    "sha256": "7ba0f12095df0ebf6c7618f0baf1b1c0ec53989da0bc743f0cf7e50852cf8126",
    "sizeBytes": 733112,
    "url": "http://aminet.net/text/edit/tinyedit_aos.lha"
  },
  "category": "Text",
  "conflicts": [],
  "deps": [],
  "description": "Lightweight text editor",
  "id": "tinyedit",
  "name": "TinyEdit",
  "provides": [],
  "requiredCapabilities": [],
  "requirements": {
    "amiSSL": true
  },
  "tier": "A",
  "version": "1.3.5"
}
