{
  "added": "2026-07-24",
  "archive": {
    "mirrors": [
      "http://us.aminet.net/comm/tcp/TheWire13.lha",
      "http://se.aminet.net/comm/tcp/TheWire13.lha"
    ],
    "sha256": "1a837360e35b5c2eb3fc8b12d3d4da5329d4526ba69d8de0d193f6860a90977e",
    "sizeBytes": 152860,
    "url": "http://aminet.net/comm/tcp/TheWire13.lha"
  },
  "category": "Internet",
  "conflicts": [],
  "deps": [],
  "description": "lightweight TCP/IP stack",
  "id": "thewire13",
  "name": "TheWire13",
  "provides": [],
  "requiredCapabilities": [],
  "tier": "A",
  "version": "1.9.1"
}
