{
  "added": "2026-07-24",
  "archive": {
    "mirrors": [
      "http://us.aminet.net/comm/tcp/curl-8.22.0.lha",
      "http://se.aminet.net/comm/tcp/curl-8.22.0.lha"
    ],
    "sha256": "5db571a72d4e96663dbf0a41c146f8ca44fef0f3446b248a0d94d0e004f8b34f",
    "sizeBytes": 4989968,
    "url": "http://aminet.net/comm/tcp/curl-8.22.0.lha"
  },
  "category": "Internet",
  "conflicts": [],
  "deps": [],
  "description": "File and data transfer tool and lib",
  "id": "curl",
  "name": "curl",
  "provides": [],
  "requiredCapabilities": [],
  "requirements": {
    "amiSSL": true,
    "network": true
  },
  "tier": "A",
  "version": "8.22.0"
}
