{
  "added": "2026-07-27",
  "archive": {
    "mirrors": [
      "http://us.aminet.net/mus/play/MintAMP.lha",
      "http://se.aminet.net/mus/play/MintAMP.lha"
    ],
    "sha256": "2bc52623a8d178c53048556cf7bbc8615437ad3f949a104002ea982375032140",
    "sizeBytes": 2973080,
    "url": "http://aminet.net/mus/play/MintAMP.lha"
  },
  "category": "Audio",
  "conflicts": [],
  "deps": [],
  "description": "Multiformat music player and net radio. 68030+; TCP/IP stack for radio streams, AmiSSL 5 for https stations.",
  "id": "mintamp",
  "name": "MintAMP",
  "provides": [],
  "requiredCapabilities": [],
  "requirements": {
    "minCPU": "68030",
    "minKS": "3.1"
  },
  "tier": "A",
  "version": "1.4.0"
}
