{
  "added": "2026-07-24",
  "archive": {
    "mirrors": [],
    "sha256": "0fb51361fe82b125971b190b78a81cb43c0a631c9d075a37b0110a0617612aba",
    "sizeBytes": 137323,
    "url": "http://aminet.net/util/moni/SnoopDos.lha"
  },
  "category": "Utilities",
  "conflicts": [],
  "deps": [],
  "description": "SnoopDos, the well known system monitor",
  "id": "snoopdos",
  "name": "SnoopDos",
  "provides": [],
  "requiredCapabilities": [],
  "tier": "A",
  "version": "3.11"
}
